{
  "$schema": "https://json-schema.org/draft/2020-12/schema",
  "$id": "https://harmony.invalid/spikes/arm-altra/schemas/run-set.schema.json",
  "title": "run-set.json \u2014 the ARM spike run-set manifest",
  "description": "The manifest half of a run-set (docs/ARM-ALTRA.md \u00a7Evidence integrity; the Rust definition is `arm_harness::evidence::RunSet` and this schema mirrors it field for field). It states what was ATTEMPTED and under what conditions. It deliberately carries NO result totals: a checker that read a total from here would be checking the harness's opinion of itself, which \u00a7Evidence integrity #2 forbids. Every number a floor checker may use is derived from `records.jsonl`, whose sha256 this manifest pins. Schema v4 is the offline hardening for the next run and has not yet been emitted on the box; retained physical results produced under v3 keep their historical checker transcripts and are not silently reinterpreted as v4.",
  "type": "object",
  "additionalProperties": false,
  "required": [
    "schema_version",
    "stage",
    "run_set_id",
    "environment",
    "mechanism",
    "images",
    "perf",
    "pinning",
    "condition",
    "weights",
    "skid_margin",
    "attempted",
    "planned",
    "records_file",
    "records_sha256"
  ],
  "properties": {
    "schema_version": {
      "description": "`arm_harness::evidence::SCHEMA_VERSION`. A checker refuses a version it does not know rather than silently misreading it.",
      "const": 4
    },
    "stage": {
      "$ref": "#/$defs/stage"
    },
    "run_set_id": {
      "description": "Identifier of this run-set. Golden evidence is immutable; a rerun creates a new run-set rather than overwriting one.",
      "type": "string",
      "minLength": 1
    },
    "environment": {
      "$ref": "#/$defs/environment"
    },
    "mechanism": {
      "$ref": "#/$defs/mechanism"
    },
    "images": {
      "description": "Every boot artifact, pinned by content and verified immediately before use (\u00a7Evidence integrity #3). A run-set that pins nothing has attested nothing.",
      "type": "array",
      "minItems": 1,
      "items": {
        "$ref": "#/$defs/image-pin"
      }
    },
    "perf": {
      "$ref": "#/$defs/perf-config"
    },
    "pinning": {
      "$ref": "#/$defs/pinning"
    },
    "condition": {
      "description": "The experimental condition this run-set sweeps (`pinned-solo`, `co-tenant-load`, \u2026).",
      "type": "string",
      "minLength": 1
    },
    "weights": {
      "description": "The MEASURED `oracle_model::Weights` used to predict counts. `null` before stage AA-1 has produced them \u2014 and a checker handed `null` refuses to check counts rather than substituting a default (task 109: skid margins, densities and count offsets are spike deliverables, never defaults).",
      "oneOf": [
        {
          "$ref": "#/$defs/weights"
        },
        {
          "type": "null"
        }
      ]
    },
    "skid_margin": {
      "description": "The N1 skid margin, measured by AA-1. `null` for the same reason as `weights`: a checker cannot bound skid without it and must say so rather than guess. The x86 `skid_margin = 256` is folklore here until AA-1 produces the N1 number.",
      "oneOf": [
        {
          "type": "integer",
          "minimum": 0
        },
        {
          "type": "null"
        }
      ]
    },
    "injection": {
      "description": "The AA-6 injection attestation (`arm_harness::evidence::InjectionAttestation`), stamped by the harness from the injection config it ACTUALLY executed. OPTIONAL and additive: stages that do not inject, and any retained pre-attestation run-set, omit it. An AA-6 run-set MUST carry it — the floor checker fails CLOSED on its absence there, because an armed force-exit landing is not an injected interrupt, so a bare AA-3 armed-overflow matrix is otherwise indistinguishable from an injected AA-6 one (bead hm-oh3v).",
      "$ref": "#/$defs/injection-attestation"
    },
    "excluded_payloads": {
      "description": "The payload classes deliberately EXCLUDED from this run-set's coverage matrix (from `arm-spike --exclude-payload`), by name. Retained so a checker can prove WHAT RAN instead of inferring it from the records: a class absent because it was ruled out is, in the records alone, indistinguishable from one silently dropped. OPTIONAL and additive: an empty exclusion set is omitted, so retained pre-field run-sets validate unchanged. At AA-3 the floor checker enforces that only the RULED carve-outs (`wfi-idle`, `llsc-atomics`) may appear here (bead hm-9zy).",
      "type": "array",
      "items": { "type": "string", "minLength": 1 }
    },
    "attempted": {
      "description": "How many samples were ATTEMPTED. Every one of them must appear in `records.jsonl` with a `sample_id` in `0..attempted`, exactly once \u2014 a missing sample is a failure to account, not a pass (\u00a7Evidence integrity #6). At least 1: a run-set that attempted nothing measures nothing and must not pass vacuously. In single-step mode one planned sample emits many step records, so this is the STEP count there; see `planned`.",
      "type": "integer",
      "minimum": 1
    },
    "planned": {
      "description": "How many PLANNED samples the run intended (the plan length). Equals `attempted` for ordinary runs; DISTINCT from it in single-step mode (where `attempted` is the step count). Each step's stable planned_sample_id must cover exactly 0..planned, so dense record renumbering or duplicated step-zero rows cannot hide a dropped plan entry.",
      "type": "integer",
      "minimum": 1
    },
    "records_file": {
      "description": "The records file, relative to this manifest. Conventionally `records.jsonl`.",
      "type": "string",
      "minLength": 1
    },
    "records_sha256": {
      "description": "sha256 of the records file's bytes, so a swapped or truncated one is caught. Lowercase hex; an optional `sha256:` prefix is tolerated.",
      "type": "string",
      "pattern": "^(sha256:)?[0-9a-f]{64}$"
    }
  },
  "$defs": {
    "stage": {
      "description": "Which stage produced this run-set (`arm_harness::evidence::Stage`). The stage is evidence, not a CLI convenience: the floor checker reads AA-3's exact-landing contract out of it.",
      "type": "string",
      "enum": [
        "aa0",
        "aa1",
        "aa2",
        "aa3",
        "aa4",
        "aa5",
        "aa6"
      ]
    },
    "exit-reason": {
      "description": "How a `KVM_RUN` ended (`arm_harness::evidence::ExitReason`). `preempt` is the patched 0004-analogue exit (`KVM_EXIT_PREEMPT`); `signal-kick` is AA-1(c)'s pre-patch host-side kick and AA-3's forbidden fallback.",
      "type": "string",
      "enum": [
        "preempt",
        "signal-kick",
        "mmio",
        "debug",
        "other"
      ]
    },
    "environment": {
      "description": "The machine, as found (`arm_harness::evidence::Environment`).",
      "type": "object",
      "additionalProperties": false,
      "required": [
        "midr",
        "soc",
        "firmware",
        "host_kernel",
        "kvm_mode"
      ],
      "properties": {
        "midr": {
          "description": "`MIDR_EL1`.",
          "type": "integer",
          "minimum": 0
        },
        "soc": {
          "description": "The SoC part, as reported by the platform.",
          "type": "string"
        },
        "firmware": {
          "description": "Firmware versions. A sorted map (`BTreeMap`, never `HashMap`): key order reaches the serialized bytes, and the bytes are hashed.",
          "type": "object",
          "additionalProperties": {
            "type": "string"
          }
        },
        "host_kernel": {
          "description": "`uname -r` of the running host kernel.",
          "type": "string"
        },
        "kvm_mode": {
          "description": "`vhe` or `nvhe`.",
          "type": "string",
          "enum": [
            "vhe",
            "nvhe"
          ]
        }
      }
    },
    "mechanism": {
      "description": "What mechanism this run CLAIMS to have exercised, and the proof (`arm_harness::evidence::Mechanism`). \u00a7Evidence integrity #4: a silent fallback must be structurally unable to masquerade as the mechanism under test \u2014 the PR-98 review found an existential-stage harness quietly exercising the stock backend and reporting green.",
      "type": "object",
      "additionalProperties": false,
      "required": [
        "kvm_patched",
        "host_kernel_sha256",
        "expected_exit_reason",
        "patch_marker_observed"
      ],
      "properties": {
        "kvm_patched": {
          "description": "`true` when the host kernel carries the 0004-analogue patch. Stock KVM (`false`) is a legitimate thing to run (AA-1's pre-patch signal-kick) but may never be reported as if it were the patched path.",
          "type": "boolean"
        },
        "host_kernel_sha256": {
          "description": "sha256 of the running host kernel image. arm64 KVM is built in (`CONFIG_KVM=y`), so the kernel IS the module identity.",
          "type": "string",
          "pattern": "^(sha256:)?[0-9a-f]{64}$"
        },
        "expected_exit_reason": {
          "description": "The exit reason every landing in this run-set must carry. The checker enforces it per record, so a run that silently fell back cannot pass.",
          "$ref": "#/$defs/exit-reason"
        },
        "patch_marker_observed": {
          "description": "Whether the patch's marker was OBSERVED in the running kernel (a positive probe), not merely assumed from the build. A run-set claiming `kvm_patched` with this `false` is refused.",
          "type": "boolean"
        }
      }
    },
    "image-pin": {
      "description": "A boot artifact, pinned by content and verified immediately before use (`arm_harness::evidence::ImagePin`). Recording a hash without verifying it is the anti-pattern \u00a7Evidence integrity #3 exists to kill.",
      "type": "object",
      "additionalProperties": false,
      "required": [
        "path",
        "sha256",
        "md5",
        "verified_before_boot"
      ],
      "properties": {
        "path": {
          "description": "Path the artifact was loaded from. Never trusted \u2014 the hash is the identity.",
          "type": "string"
        },
        "sha256": {
          "description": "sha256 of the bytes actually loaded.",
          "type": "string",
          "pattern": "^(sha256:)?[0-9a-f]{64}$"
        },
        "md5": {
          "description": "md5 cross-reference, per the box-gate image discipline \u2014 optional (sha256 is the identity, and no md5 implementation is on the dependency whitelist). When present, 32 lowercase hex digits.",
          "oneOf": [
            {
              "type": "string",
              "pattern": "^[0-9a-f]{32}$"
            },
            {
              "type": "null"
            }
          ]
        },
        "verified_before_boot": {
          "description": "Whether the hash was recomputed and compared IMMEDIATELY BEFORE the artifact was used. `false` fails the checker.",
          "type": "boolean"
        }
      }
    },
    "perf-config": {
      "description": "The perf event configuration behind the work clock (`arm_harness::evidence::PerfConfig`).",
      "type": "object",
      "additionalProperties": false,
      "required": [
        "raw_event",
        "exclude_host",
        "exclude_guest",
        "exclude_hv",
        "pinned",
        "sample_period"
      ],
      "properties": {
        "raw_event": {
          "description": "The raw event. On N1, `BR_RETIRED` is `0x21` = 33 and counts all architecturally executed branch instructions, taken or not (AA1-F1; docs/ARM-PORT.md, docs/ARM-ALTRA.md \u00a72). This ARM binding does not alter the x86 retired-conditional-branch clock. Recorded rather than assumed, so a run that silently counted a different event is visible as such.",
          "type": "integer",
          "minimum": 0
        },
        "exclude_host": {
          "description": "`exclude_host` \u2014 the count must be guest-only.",
          "type": "boolean"
        },
        "exclude_guest": {
          "type": "boolean"
        },
        "exclude_hv": {
          "type": "boolean"
        },
        "pinned": {
          "description": "Whether the event was opened pinned (never multiplexed). A multiplexed counter scales its count, silently corrupting every measurement.",
          "type": "boolean"
        },
        "sample_period": {
          "description": "The sampling period armed, when the run arms overflow. `null` in counting mode.",
          "oneOf": [
            {
              "type": "integer",
              "minimum": 1
            },
            {
              "type": "null"
            }
          ]
        }
      }
    },
    "pinning": {
      "description": "Core pinning and frequency posture (`arm_harness::evidence::Pinning`). Pinning is a CORRECTNESS condition on the N1/V1 lineage, not hygiene: the arm64 kernel can miss PMU overflow interrupts on core migration (rr issue #3607), and a missed overflow means `run_until` never breaks out of `KVM_RUN`.",
      "type": "object",
      "additionalProperties": false,
      "required": [
        "pinned",
        "core",
        "governor",
        "migration_probe"
      ],
      "properties": {
        "pinned": {
          "description": "Whether the vCPU thread and its perf context were hard-pinned. The checker demands `true` everywhere except AA-1's one sanctioned migration probe.",
          "type": "boolean"
        },
        "core": {
          "description": "The core they were pinned to. A pinned run that did not record its core is unverifiable.",
          "oneOf": [
            {
              "type": "integer",
              "minimum": 0
            },
            {
              "type": "null"
            }
          ]
        },
        "governor": {
          "description": "The cpufreq governor. V-time counts are frequency-independent; this matters only for wall-clock numbers, and is recorded so that is checkable.",
          "type": "string"
        },
        "migration_probe": {
          "description": "Set ONLY for AA-1's deliberate, bounded migration probe \u2014 the one sanctioned unpinned run.",
          "type": "boolean"
        }
      }
    },
    "weights": {
      "description": "The measured per-occurrence `BR_RETIRED` contributions (`oracle_model::Weights`). Deliberately has no `Default` in code and no default here: whether an exception entry, an `ERET`, an `SVC` or a `WFI` is counted by `BR_RETIRED` on Neoverse N1 is exactly the kind of microarchitectural fact this apparatus must not guess.",
      "type": "object",
      "additionalProperties": false,
      "required": [
        "exception_entry",
        "exception_return",
        "svc_instruction",
        "wfi_instruction",
        "window_offset"
      ],
      "properties": {
        "exception_entry": {
          "description": "`BR_RETIRED` contribution of one exception entry.",
          "type": "integer",
          "minimum": 0
        },
        "exception_return": {
          "description": "`BR_RETIRED` contribution of one `ERET`.",
          "type": "integer",
          "minimum": 0
        },
        "svc_instruction": {
          "description": "`BR_RETIRED` contribution of one `SVC`.",
          "type": "integer",
          "minimum": 0
        },
        "wfi_instruction": {
          "description": "`BR_RETIRED` contribution of one `WFI`.",
          "type": "integer",
          "minimum": 0
        },
        "window_offset": {
          "description": "The constant offset of the counting window itself. x86's analogue measured n+2; on N1 it is unknown until AA-1 measures it.",
          "type": "integer",
          "minimum": 0
        }
      }
    },
    "injection-attestation": {
      "description": "The AA-6 injection attestation (`arm_harness::evidence::InjectionAttestation`). Written from the injection config the run loop actually executed, never echoed from CLI intent. AA-6 certifies determinism UNDER injection; this stamp is what lets the checker tell an injected run-set from a bare AA-3 armed-overflow matrix and fail closed when it is missing or says OFF.",
      "type": "object",
      "additionalProperties": false,
      "required": [
        "enabled",
        "inject_ppi",
        "inject_at_work"
      ],
      "properties": {
        "enabled": {
          "description": "Whether the run loop configured event injection. `false` is the AA-5(c) negative-control posture (a byte-identical, un-injected boot) — legitimate to run, but an AA-6 matrix stamped OFF injected nothing, and the checker refuses it.",
          "type": "boolean"
        },
        "inject_ppi": {
          "description": "The injected PPI INTID (`--inject-ppi`) issued via `KVM_IRQ_LINE` — the harness's dedicated unowned line, never the timer's KVM-owned PPI. An integer when `enabled`; `null` on the OFF control.",
          "oneOf": [
            {
              "type": "integer",
              "minimum": 0
            },
            {
              "type": "null"
            }
          ]
        },
        "inject_at_work": {
          "description": "The landing index the injection fires at (`--inject-at-work`), for the LinuxGuest lane that injects at ONE seeded Moment. `null` for the bare-payload lane (which injects at every exact landing) and `null` on the OFF control, so it is not what a checker keys ON/OFF on — `enabled` is.",
          "oneOf": [
            {
              "type": "integer",
              "minimum": 0
            },
            {
              "type": "null"
            }
          ]
        }
      }
    }
  }
}
